{
  "schemaVersion": 1,
  "fixtureId": "bval-09-vector-recall-ground-truth",
  "deterministic": true,
  "seed": 9709,
  "domain": "approximate-vector-recall",
  "input": {
    "metric": "cosine",
    "queryVector": [1.0, 0.0],
    "vectors": [
      { "id": "v01", "value": [1.0, 0.0] },
      { "id": "v02", "value": [0.99, 0.01] },
      { "id": "v03", "value": [0.98, 0.02] },
      { "id": "v04", "value": [0.97, 0.03] },
      { "id": "v05", "value": [0.96, 0.04] },
      { "id": "v06", "value": [0.95, 0.05] },
      { "id": "v07", "value": [0.94, 0.06] },
      { "id": "v08", "value": [0.93, 0.07] },
      { "id": "v09", "value": [0.92, 0.08] },
      { "id": "v10", "value": [0.91, 0.09] }
    ],
    "k": 10,
    "approximateReturnedIds": ["v01"]
  },
  "expected": {
    "exactTopKIds": ["v01", "v02", "v03", "v04", "v05", "v06", "v07", "v08", "v09", "v10"],
    "recallAtK": 0.1,
    "minimumAcceptedRecall": 0.9,
    "comparisonQualifies": false,
    "requiredRecallAtK": [1, 10, 100],
    "scoreError": "absolute cosine score deviation from exact source-vector ground truth",
    "rankError": "absolute rank displacement from the full exact cosine ordering",
    "quantisationError": "absolute cosine score deviation from original unquantised source vectors"
  }
}
